{
  "authorizations": {
    "development_fit_authorized": true,
    "e0_u_authorized": false,
    "evaluation_authorized": false,
    "future_outcomes_accessed": false
  },
  "base_authority": {
    "dls_lock_commit": "92a9fb1ba17a61cb91c0b89782f2dd4bf956b5e1",
    "dls_patch_head": "b660a81d65ca8bf1d40ada2f083124f558c8a4c5",
    "p0_bundle": {
      "commit": "b075d4f1606aa35c1b86493604c18845f2d28a2f",
      "future_outcomes_accessed": false,
      "parent": "92a9fb1ba17a61cb91c0b89782f2dd4bf956b5e1",
      "payload": {
        "bytes": 1377124,
        "md5": "690735883981160b6347a722420603e0",
        "path": "data/closure_v1/development/sequences/P0/expert_no_current.parquet",
        "role": "p0_sequence_payload",
        "sha256": "a10fbe5054d795b44dac1da2853a387b4dbead3e04dd7d9d942313b2aa5318fd"
      },
      "physical_payload_verified": true,
      "pointer_md5": "690735883981160b6347a722420603e0",
      "pointer_size": 1377124,
      "records": [
        {
          "bytes": 108,
          "path": "data/closure_v1/development/sequences/P0/expert_no_current.parquet.dvc",
          "role": "published_p0_bundle_component",
          "sha256": "955ea4612f2fa705d05aac7e325db57ba728ef319536c1184528b8f02a54196a"
        },
        {
          "bytes": 5954,
          "path": "reports/closure_v1/01_surface/sequences/P0/expert_no_current_manifest.json",
          "role": "published_p0_bundle_component",
          "sha256": "ec5c4a88eeb44c431484bced3053adf4f2824cda3db2a60ab9719f7be2f310fc"
        },
        {
          "bytes": 356,
          "path": "reports/closure_v1/01_surface/sequences/P0/expert_no_current_summary.csv",
          "role": "published_p0_bundle_component",
          "sha256": "a6c6c837a82c13a9321233de03b588c60b7a4198b77dcf31b3c7a62027752c3e"
        },
        {
          "bytes": 56843,
          "path": "src/experiments/audit_closure_p0_sequence_bundle.py",
          "role": "published_p0_bundle_component",
          "sha256": "07c40c63282c9de623e2fb0dc38de6e8735cd85fb3a9a1d932cd05a7ea5273b7"
        },
        {
          "bytes": 23663,
          "path": "tests/test_audit_closure_p0_sequence_bundle.py",
          "role": "published_p0_bundle_component",
          "sha256": "01923d42d5d63135ea66907260ee5f1f2d688086477d6a299bec77e50995e672"
        }
      ],
      "records_sha256": "da2e622abb03738becb7cd27ef7c37715fe87b96ed921654da5ac0ec9fe987c1"
    },
    "p_dls_base_preserved_components": {
      "count": 40,
      "paths": [
        "configs/closure_v1/development_runtime.schema.json",
        "configs/closure_v1/development_runtime.yaml",
        "configs/closure_v1/development_runtime_lock.schema.json",
        "configs/closure_v1/development_runtime_patch_lock.schema.json",
        "configs/closure_v1/dvc_artifacts_post_lock.yaml",
        "docs/closure_v1/E0_D_RUNTIME_PATCH_1.md",
        "poetry.lock",
        "pyproject.toml",
        "src/__init__.py",
        "src/data/prepare_commit_artifacts.py",
        "src/experiments/__init__.py",
        "src/experiments/build_closure_expert_state.py",
        "src/experiments/build_closure_holdout.py",
        "src/experiments/build_common_origin_manifest.py",
        "src/experiments/build_pipe_sequences.py",
        "src/experiments/closure_contract.py",
        "src/experiments/closure_development_guard.py",
        "src/experiments/closure_development_runtime_lock.py",
        "src/experiments/closure_development_runtime_patch.py",
        "src/experiments/closure_runtime_contract.py",
        "src/experiments/fit_closure_anfis_state.py",
        "src/experiments/lock_closure_development_runtime.py",
        "src/experiments/lock_closure_development_runtime_patch.py",
        "src/experiments/rollout_pipe_grud.py",
        "src/experiments/run_adaptive_anfis_real_smoke.py",
        "src/experiments/train_pipe_grud.py",
        "src/fuzzy/__init__.py",
        "src/fuzzy/adaptive_anfis.py",
        "src/fuzzy/expert.py",
        "src/pandas_utils.py",
        "tests/conftest.py",
        "tests/test_build_closure_expert_state.py",
        "tests/test_closure_development_runtime_lock.py",
        "tests/test_closure_development_runtime_patch.py",
        "tests/test_closure_runtime_contract.py",
        "tests/test_data_versioning_config.py",
        "tests/test_dvc_add_from_manifest.py",
        "tests/test_fit_closure_anfis_state.py",
        "tests/test_lock_closure_development_runtime.py",
        "tests/test_prepare_commit_artifacts.py"
      ],
      "paths_sha256": "59df505f57176cba4b737404da194bf0d48e58dbf729fa9a9704019fa4316322",
      "records": [
        {
          "bytes": 55502,
          "path": "configs/closure_v1/development_runtime.schema.json",
          "role": "preserved_locked_component",
          "sha256": "1abb28734ab3dc4ef2cdc68ce13876741ee42b4b5a8de35aadb332e95aee9709"
        },
        {
          "bytes": 46105,
          "path": "configs/closure_v1/development_runtime.yaml",
          "role": "preserved_locked_component",
          "sha256": "0b2588248ee006f7d8e8843291b6a5847201a36fed35422473c9c0aa9492b10d"
        },
        {
          "bytes": 20606,
          "path": "configs/closure_v1/development_runtime_lock.schema.json",
          "role": "preserved_locked_component",
          "sha256": "5314f5d15a4e516d1a0500a7ca5a69cb412ac4827f42973f26a8ec45fcd63204"
        },
        {
          "bytes": 78141,
          "path": "configs/closure_v1/development_runtime_patch_lock.schema.json",
          "role": "preserved_locked_component",
          "sha256": "652fa86482b585985eb0db260af1e499ddc16a620b8fa8c6f54e87c5c767dbac"
        },
        {
          "bytes": 7305,
          "path": "configs/closure_v1/dvc_artifacts_post_lock.yaml",
          "role": "preserved_locked_component",
          "sha256": "912fbdf38d1ec4cebd92dfe01e6cd760031c2c55cba3147df4707b025974ff5a"
        },
        {
          "bytes": 31120,
          "path": "docs/closure_v1/E0_D_RUNTIME_PATCH_1.md",
          "role": "preserved_locked_component",
          "sha256": "8b8545ccc9ca99a4820770d3f002a39390343b70acfaab1e2dbff2c7060fce21"
        },
        {
          "bytes": 497461,
          "path": "poetry.lock",
          "role": "preserved_locked_component",
          "sha256": "eb686d9811fde771e632dcbe6814879a6999dfd5fa94467915151651b894a0d4"
        },
        {
          "bytes": 1699,
          "path": "pyproject.toml",
          "role": "preserved_locked_component",
          "sha256": "ea396336baba003de55e371c49c5bab5269de9779cba82bd4045e44f82ba3d22"
        },
        {
          "bytes": 34,
          "path": "src/__init__.py",
          "role": "preserved_locked_component",
          "sha256": "580b36dfeb9cdba3bcc5a3bbe94a60aa170a40512874dc58bb510e60f3be71c6"
        },
        {
          "bytes": 73927,
          "path": "src/data/prepare_commit_artifacts.py",
          "role": "preserved_locked_component",
          "sha256": "a0f689f870d230475d11362bdf8ed52ab2337aa3307af1c8cd25b7a9a0d64141"
        },
        {
          "bytes": 61,
          "path": "src/experiments/__init__.py",
          "role": "preserved_locked_component",
          "sha256": "dfec3a945384692c654b2a80b17e6e6a41732493d476cddb69a67aa45209d886"
        },
        {
          "bytes": 28645,
          "path": "src/experiments/build_closure_expert_state.py",
          "role": "preserved_locked_component",
          "sha256": "9a48ee45de0709fe871ae0d5bebad5e73117564dbd111a54bdd871b1336cae4a"
        },
        {
          "bytes": 67719,
          "path": "src/experiments/build_closure_holdout.py",
          "role": "preserved_locked_component",
          "sha256": "a79c746c2fa0468637744a5c5aa71dacfea8843130edfe6e9104a2d9ea0abd9e"
        },
        {
          "bytes": 36987,
          "path": "src/experiments/build_common_origin_manifest.py",
          "role": "preserved_locked_component",
          "sha256": "691d9c9951c37881e17280609b099551b7f87ccb60a126ef977073878cc281d0"
        },
        {
          "bytes": 27658,
          "path": "src/experiments/build_pipe_sequences.py",
          "role": "preserved_locked_component",
          "sha256": "05fd7b401fc20555ad94c3b2f9cec4939330b70edae5ac0857f3536328f9bc27"
        },
        {
          "bytes": 87743,
          "path": "src/experiments/closure_contract.py",
          "role": "preserved_locked_component",
          "sha256": "c3d0ea8b1ff74ddb31a8bbe1a12875eb5423b379dd834c5ed9d87cfc7529d9b8"
        },
        {
          "bytes": 30856,
          "path": "src/experiments/closure_development_guard.py",
          "role": "preserved_locked_component",
          "sha256": "98115a235a88ce41b356260c8c3d953064c01bbd3d56e9b131e71c2e1eed7683"
        },
        {
          "bytes": 121930,
          "path": "src/experiments/closure_development_runtime_lock.py",
          "role": "preserved_locked_component",
          "sha256": "b988c1c732afc4416c8ea439d6f54c49a104973fd145121d7966a3cc9be91c9e"
        },
        {
          "bytes": 169757,
          "path": "src/experiments/closure_development_runtime_patch.py",
          "role": "preserved_locked_component",
          "sha256": "9c14e5442b13b9a7f8f9f4a3a87d95f16e582abdda7092576388afe24b32b04d"
        },
        {
          "bytes": 113626,
          "path": "src/experiments/closure_runtime_contract.py",
          "role": "preserved_locked_component",
          "sha256": "4639e003e482682aef0da69816e71f8c9d77a38fc3fb4965fd416f0569ce3432"
        },
        {
          "bytes": 60060,
          "path": "src/experiments/fit_closure_anfis_state.py",
          "role": "preserved_locked_component",
          "sha256": "c186bc8369bc39774f1bb0043208d2db7af633eccc6b8047743fd9dabcb13be2"
        },
        {
          "bytes": 8082,
          "path": "src/experiments/lock_closure_development_runtime.py",
          "role": "preserved_locked_component",
          "sha256": "c750b04a3089af437e84fcea285bcf1915918b1715a99da983058ec7c0381c57"
        },